### ISSUE TITLE
Device commands over API fail 

### ISSUE THREAD

**Issue by gitsaycat** [eclipse/kapua#2467]
**Describe the bug**
Device command issued from NodeJS code (node-red) using the Kapua API client generated by Swagger CodeGen (javascript) fails

**To Reproduce**

The following node-red code encapsulated in a function block fails with an HTTP 504 timeout:

```
authApi.authenticationApiKey(apiKeyCreds, function(error, accessToken, response) {
    if (error) {
        node.error(error);
    } else {
        //node.log('Success authenticating...returned accesstokenId...' + accessToken.tokenId + " for " + accessToken.userId + " created on " + accessToken.createdOn + " and expiring " + accessToken.expiresOn);
        node.log('Success authenticating...');
        var kapuaAccessToken = defaultClient.authentications['kapuaAccessToken'];
        kapuaAccessToken.apiKey = accessToken.tokenId;

        var devicesApi = new apiclient.DevicesApi();
        var deviceId = "test-1"; 
        //var cmdInput = new apiclient.DeviceCommandInput(); // DeviceCommandInput | The input command
        //cmdInput.command = "lsblk";
        
        let cmdInput = {
            "environment": [],//["string"],
            "timeout": 60,
            "password": null,
            "arguments": [],//["string"],
            "body": null,//["string"],
            "command": "lsblk",
            "workingDir": "/",
            "runAsynch": false,
            "stdin": null,
            "scopeId": accessToken.scopeId,
            "id": "string",
            "createdOn": "2019-02-21T02:07:58.770Z",
            "createdBy": "api",
            "type": "string"
        };
  
        var opts = { 
          'timeout': 60 // Integer | The timeout of the command execution
        };
        
        var callback = 
        function(error, data, response) {
            if (error) {
                console.error(error);
            } else {
                console.log('Cmd successfully executed on device. Returned data: ' + JSON.stringify(data));
            }
        };
        devicesApi.deviceCommandExecute(accessToken.scopeId, deviceId, cmdInput, opts, callback);        
        node.warn("Trying to execute command on device...");
    }
});

node.trace("Trying to authenticate...");
return null;
```

**Expected behavior**
The same parameters typed in through the Kapua console return the output of the lsblk command.
The above code should do the same, but times out on the front end

**Screenshots**

**From the front end / browser** - I see an HTTP 504 timeout
**TCPDUMP on the server side shows the following**:

> 
> POST /v1/Raz4JEnmDcs/devices/test-1/commands/_execute?timeout=60 HTTP/1.0
> E..&.)@.@..u............X.Kr0oH:....^L.....
> o....!{ POST /v1/Raz4JEnmDcs/devices/test-1/commands/_execute?timeout=60 HTTP/1.0
> Host: --.--.--.--:8081
> Connection: close
> Content-Length: 251
> X-Real-IP: --.--.--.--
> X-Forwarded-For: --.--.--.--
> X-Forwarded-Proto: https
> X-Forwarded-Ssl: on
> X-Forwarded-Port: 443
> Accept-Encoding: gzip, deflate
> User-Agent: node-superagent/1.7.1
> Authorization: eyJhbGciOiJSUzI1NiJ9.eyJpc3MiOiJodHRwczovL3d3dy5lY2xpcHNlLm9yZy9rYXB1YSIsImlhdCI6MTU1MTMxMjk3NiwiZXhwIjoxNTUxMzE0Nzc2LCJzdWIiOiJiTTVsNWItaGkxbyIsInNJZCI6IlJhejRKRW5tRGNzIn0.c8QCbz62wIKHA83NSO31ARPQBVSIVHGp13QOOaIDc6Q8R-5_CdLmTQqX8c6_0TyIAfwd1wG57I..................................-c_0zJBDaAXIx5WL0La6aOjBgBVC0L_xDehPUa9Ir2yQi4q9QXA13A51PO8edUiWUU_3hjYvgmyJxgVrmYEVT9Ndnz5Y57RTtqGC7xCASkBmCh3lnwYiTI82QAl0jD8Xloc05eMDy_WmEpP_1J5uP-L5XDRyHArr47EaUniDYHUhy00tm5A89MiKb1IYWHcD4ueB9ZJLPbFo_ldDu4MU1fujqWbOL8DX253gAGn6_prqRnnSFpTf10KCqM2LeXFFUyDU5pLggmKQXb5DlxnfkIyC1sQeAOrxK852jnxWrykxaeDrrDmq7aX3sOsssdxiPjvf8id8hGNl2U9dWwLhZ8yBhjqaQWEhpvqqY
> Content-Type: application/json
> Accept: application/json
> 
> {"environment":[],"timeout":60,"password":null,"arguments":[],"body":null,"command":"lsblk","workingDir":"/","runAsynch":false,"stdin":null,"scopeId":"Raz4JEnmDcs","id":"string","createdOn":"2019-02-21T02:07:58.770Z","createdBy":"api","type":"string"}
> 00:16:16.966948 IP ---------------------- > -------------: Flags [P.], seq 1:595, ack 1522, win 251, options [nop,nop,TS val 3827399492 ecr 1878432475], length 594: HTTP: HTTP/1.1 500 Internal Server Error
> E....m@.@...............0oH:X.Qd....Z......
> .!{Do...HTTP/1.1 500 Internal Server Error
> Set-Cookie: JSESSIONID=no1.node0;Path=/;Expires=Thu, 01-Jan-1970 00:00:00 GMT;Max-Age=0
> Expires: Thu, 01 Jan 1970 00:00:00 GMT
> Set-Cookie: kapua-rememberme=deleteMe; Path=/; Max-Age=0; Expires=Wed, 27-Feb-2019 00:16:16 GMT
> Content-Type: application/json
> Access-Control-Allow-Origin: *
> Access-Control-Allow-Methods: GET, POST, DELETE, PUT
> Access-Control-Allow-Headers: X-Requested-With, Content-Type, Authorization
> Content-Length: 52
> Server: Jetty(9.4.12.v20180830)
> 
> {"httpErrorCode":500,"message":"HTTP 404 Not Found"}
> 00:16:16.966948 IP --------------- > ip-----------------------: Flags [P.], seq 1:595, ack 1522, win 251, options [nop,nop,TS val 3827399492 ecr 1878432475], length 594: HTTP: HTTP/1.1 500 Internal Server Error
> E....m@.@...............0oH:X.Qd....Z......
> .!{Do...HTTP/1.1 500 Internal Server Error
> Set-Cookie: JSESSIONID=node0dmxjigczwdmd1e4t671kv0t0e641.node0;Path=/;Expires=Thu, 01-Jan-1970 00:00:00 GMT;Max-Age=0
> Expires: Thu, 01 Jan 1970 00:00:00 GMT
> Set-Cookie: kapua-rememberme=deleteMe; Path=/; Max-Age=0; Expires=Wed, 27-Feb-2019 00:16:16 GMT
> Content-Type: application/json
> Access-Control-Allow-Origin: *
> Access-Control-Allow-Methods: GET, POST, DELETE, PUT
> Access-Control-Allow-Headers: X-Requested-With, Content-Type, Authorization
> Content-Length: 52
> Server: Jetty(9.4.12.v20180830)
> 
> {"httpErrorCode":500,"message":"HTTP 404 Not Found"}

**Kapua API logs show the following stacktrace** 

> 
> > k1.0.3_api       | 00:57:57.037 [qtp913190639-13] ERROR o.e.k.a.a.c.e.ThrowableMapper - Severe error!
> k1.0.3_api       | org.glassfish.jersey.server.ParamException$PathParamException: HTTP 404 Not Found
> k1.0.3_api       |      at org.glassfish.jersey.server.internal.inject.PathParamValueFactoryProvider$PathParamValueFactory.provide(PathParamValueFactoryProvider.java:95)
> k1.0.3_api       |      at org.glassfish.jersey.server.spi.internal.ParamValueFactoryWithSource.provide(ParamValueFactoryWithSource.java:71)
> k1.0.3_api       |      at org.glassfish.jersey.server.spi.internal.ParameterValueHelper.getParameterValues(ParameterValueHelper.java:90)
> k1.0.3_api       |      at org.glassfish.jersey.server.model.internal.JavaResourceMethodDispatcherProvider$AbstractMethodParamInvoker.getParamValues(JavaResourceMethodDispatcherProvider.java:127)
> k1.0.3_api       |      at org.glassfish.jersey.server.model.internal.JavaResourceMethodDispatcherProvider$TypeOutInvoker.doDispatch(JavaResourceMethodDispatcherProvider.java:205)
> k1.0.3_api       |      at org.glassfish.jersey.server.model.internal.AbstractJavaResourceMethodDispatcher.dispatch(AbstractJavaResourceMethodDispatcher.java:99)
> k1.0.3_api       |      at org.glassfish.jersey.server.model.ResourceMethodInvoker.invoke(ResourceMethodInvoker.java:389)
> k1.0.3_api       |      at org.glassfish.jersey.server.model.ResourceMethodInvoker.apply(ResourceMethodInvoker.java:347)
> k1.0.3_api       |      at org.glassfish.jersey.server.model.ResourceMethodInvoker.apply(ResourceMethodInvoker.java:102)
> k1.0.3_api       |      at org.glassfish.jersey.server.ServerRuntime$2.run(ServerRuntime.java:326)
> k1.0.3_api       |      at org.glassfish.jersey.internal.Errors$1.call(Errors.java:271)
> k1.0.3_api       |      at org.glassfish.jersey.internal.Errors$1.call(Errors.java:267)
> k1.0.3_api       |      at org.glassfish.jersey.internal.Errors.process(Errors.java:315)
> k1.0.3_api       |      at org.glassfish.jersey.internal.Errors.process(Errors.java:297)
> k1.0.3_api       |      at org.glassfish.jersey.internal.Errors.process(Errors.java:267)
> k1.0.3_api       |      at org.glassfish.jersey.process.internal.RequestScope.runInScope(RequestScope.java:317)
> k1.0.3_api       |      at org.glassfish.jersey.server.ServerRuntime.process(ServerRuntime.java:305)
> k1.0.3_api       |      at org.glassfish.jersey.server.ApplicationHandler.handle(ApplicationHandler.java:1154)
> k1.0.3_api       |      at org.glassfish.jersey.servlet.WebComponent.serviceImpl(WebComponent.java:473)
> k1.0.3_api       |      at org.glassfish.jersey.servlet.WebComponent.service(WebComponent.java:427)
> k1.0.3_api       |      at org.glassfish.jersey.servlet.ServletContainer.service(ServletContainer.java:388)
> k1.0.3_api       |      at org.glassfish.jersey.servlet.ServletContainer.service(ServletContainer.java:341)
> k1.0.3_api       |      at org.glassfish.jersey.servlet.ServletContainer.service(ServletContainer.java:228)
> k1.0.3_api       |      at org.eclipse.jetty.servlet.ServletHolder.handle(ServletHolder.java:865)
> k1.0.3_api       |      at org.eclipse.jetty.servlet.ServletHandler$CachedChain.doFilter(ServletHandler.java:1655)
> k1.0.3_api       |      at org.eclipse.jetty.websocket.server.WebSocketUpgradeFilter.doFilter(WebSocketUpgradeFilter.java:215)
> k1.0.3_api       |      at org.eclipse.jetty.servlet.ServletHandler$CachedChain.doFilter(ServletHandler.java:1642)
> k1.0.3_api       |      at org.apache.shiro.web.servlet.ProxiedFilterChain.doFilter(ProxiedFilterChain.java:61)
> k1.0.3_api       |      at org.apache.shiro.web.servlet.AdviceFilter.executeChain(AdviceFilter.java:108)
> k1.0.3_api       |      at org.apache.shiro.web.servlet.AdviceFilter.doFilterInternal(AdviceFilter.java:137)
> k1.0.3_api       |      at org.apache.shiro.web.servlet.OncePerRequestFilter.doFilter(OncePerRequestFilter.java:125)
> k1.0.3_api       |      at org.apache.shiro.web.servlet.ProxiedFilterChain.doFilter(ProxiedFilterChain.java:66)
> k1.0.3_api       |      at org.apache.shiro.web.servlet.AdviceFilter.executeChain(AdviceFilter.java:108)
> k1.0.3_api       |      at org.apache.shiro.web.servlet.AdviceFilter.doFilterInternal(AdviceFilter.java:137)
> k1.0.3_api       |      at org.apache.shiro.web.servlet.OncePerRequestFilter.doFilter(OncePerRequestFilter.java:125)
> k1.0.3_api       |      at org.apache.shiro.web.servlet.ProxiedFilterChain.doFilter(ProxiedFilterChain.java:66)
> k1.0.3_api       |      at org.apache.shiro.web.servlet.AbstractShiroFilter.executeChain(AbstractShiroFilter.java:449)
> k1.0.3_api       |      at org.apache.shiro.web.servlet.AbstractShiroFilter$1.call(AbstractShiroFilter.java:365)
> k1.0.3_api       |      at org.apache.shiro.subject.support.SubjectCallable.doCall(SubjectCallable.java:90)
> k1.0.3_api       |      at org.apache.shiro.subject.support.SubjectCallable.call(SubjectCallable.java:83)
> k1.0.3_api       |      at org.apache.shiro.subject.support.DelegatingSubject.execute(DelegatingSubject.java:383)
> k1.0.3_api       |      at org.apache.shiro.web.servlet.AbstractShiroFilter.doFilterInternal(AbstractShiroFilter.java:362)
> k1.0.3_api       |      at org.apache.shiro.web.servlet.OncePerRequestFilter.doFilter(OncePerRequestFilter.java:125)
> k1.0.3_api       |      at org.eclipse.jetty.servlet.ServletHandler$CachedChain.doFilter(ServletHandler.java:1634)
> k1.0.3_api       |      at org.eclipse.jetty.servlet.ServletHandler.doHandle(ServletHandler.java:533)
> k1.0.3_api       |      at org.eclipse.jetty.server.handler.ScopedHandler.handle(ScopedHandler.java:146)
> k1.0.3_api       |      at org.eclipse.jetty.security.SecurityHandler.handle(SecurityHandler.java:548)
> k1.0.3_api       |      at org.eclipse.jetty.server.handler.HandlerWrapper.handle(HandlerWrapper.java:132)
> k1.0.3_api       |      at org.eclipse.jetty.server.handler.ScopedHandler.nextHandle(ScopedHandler.java:257)
> k1.0.3_api       |      at org.eclipse.jetty.server.session.SessionHandler.doHandle(SessionHandler.java:1595)
> k1.0.3_api       |      at org.eclipse.jetty.server.handler.ScopedHandler.nextHandle(ScopedHandler.java:255)
> k1.0.3_api       |      at org.eclipse.jetty.server.handler.ContextHandler.doHandle(ContextHandler.java:1340)
> k1.0.3_api       |      at org.eclipse.jetty.server.handler.ScopedHandler.nextScope(ScopedHandler.java:203)
> k1.0.3_api       |      at org.eclipse.jetty.servlet.ServletHandler.doScope(ServletHandler.java:473)
> k1.0.3_api       |      at org.eclipse.jetty.server.session.SessionHandler.doScope(SessionHandler.java:1564)
> k1.0.3_api       |      at org.eclipse.jetty.server.handler.ScopedHandler.nextScope(ScopedHandler.java:201)
> k1.0.3_api       |      at org.eclipse.jetty.server.handler.ContextHandler.doScope(ContextHandler.java:1242)
> k1.0.3_api       |      at org.eclipse.jetty.server.handler.ScopedHandler.handle(ScopedHandler.java:144)
> k1.0.3_api       |      at org.eclipse.jetty.server.handler.ContextHandlerCollection.handle(ContextHandlerCollection.java:220)
> k1.0.3_api       |      at org.eclipse.jetty.server.handler.HandlerCollection.handle(HandlerCollection.java:126)
> k1.0.3_api       |      at org.eclipse.jetty.server.handler.StatisticsHandler.handle(StatisticsHandler.java:174)
> k1.0.3_api       |      at org.eclipse.jetty.server.handler.HandlerWrapper.handle(HandlerWrapper.java:132)
> k1.0.3_api       |      at org.eclipse.jetty.server.Server.handle(Server.java:503)
> k1.0.3_api       |      at org.eclipse.jetty.server.HttpChannel.handle(HttpChannel.java:364)
> k1.0.3_api       |      at org.eclipse.jetty.server.HttpConnection.onFillable(HttpConnection.java:260)
> k1.0.3_api       |      at org.eclipse.jetty.io.AbstractConnection$ReadCallback.succeeded(AbstractConnection.java:305)
> k1.0.3_api       |      at org.eclipse.jetty.io.FillInterest.fillable(FillInterest.java:103)
> k1.0.3_api       |      at org.eclipse.jetty.io.ChannelEndPoint$2.run(ChannelEndPoint.java:118)
> k1.0.3_api       |      at org.eclipse.jetty.util.thread.strategy.EatWhatYouKill.runTask(EatWhatYouKill.java:333)
> k1.0.3_api       |      at org.eclipse.jetty.util.thread.strategy.EatWhatYouKill.doProduce(EatWhatYouKill.java:310)
> k1.0.3_api       |      at org.eclipse.jetty.util.thread.strategy.EatWhatYouKill.tryProduce(EatWhatYouKill.java:168)
> k1.0.3_api       |      at org.eclipse.jetty.util.thread.strategy.EatWhatYouKill.run(EatWhatYouKill.java:126)
> k1.0.3_api       |      at org.eclipse.jetty.util.thread.ReservedThreadExecutor$ReservedThread.run(ReservedThreadExecutor.java:366)
> k1.0.3_api       |      at org.eclipse.jetty.util.thread.QueuedThreadPool.runJob(QueuedThreadPool.java:765)
> k1.0.3_api       |      at org.eclipse.jetty.util.thread.QueuedThreadPool$2.run(QueuedThreadPool.java:683)
> k1.0.3_api       |      at java.lang.Thread.run(Thread.java:748)
> k1.0.3_api       | Caused by: org.glassfish.jersey.internal.inject.ExtractorException: java.lang.IllegalArgumentException: Last unit does not have enough valid bits
> k1.0.3_api       |      at org.glassfish.jersey.server.internal.inject.ParamConverters$AbstractStringReader.fromString(ParamConverters.java:95)
> k1.0.3_api       |      at org.glassfish.jersey.server.internal.inject.AbstractParamValueExtractor.convert(AbstractParamValueExtractor.java:139)
> k1.0.3_api       |      at org.glassfish.jersey.server.internal.inject.AbstractParamValueExtractor.fromString(AbstractParamValueExtractor.java:130)
> k1.0.3_api       |      at org.glassfish.jersey.server.internal.inject.SingleValueExtractor.extract(SingleValueExtractor.java:84)
> k1.0.3_api       |      at org.glassfish.jersey.server.internal.inject.PathParamValueFactoryProvider$PathParamValueFactory.provide(PathParamValueFactoryProvider.java:93)
> k1.0.3_api       |      ... 75 common frames omitted
> k1.0.3_api       | Caused by: java.lang.IllegalArgumentException: Last unit does not have enough valid bits
> k1.0.3_api       |      at java.util.Base64$Decoder.decode0(Base64.java:734)
> k1.0.3_api       |      at java.util.Base64$Decoder.decode(Base64.java:526)
> k1.0.3_api       |      at java.util.Base64$Decoder.decode(Base64.java:549)
> k1.0.3_api       |      at org.eclipse.kapua.app.api.resources.v1.resources.model.EntityId.<init>(EntityId.java:39)
> k1.0.3_api       |      at sun.reflect.GeneratedConstructorAccessor145.newInstance(Unknown Source)
> k1.0.3_api       |      at sun.reflect.DelegatingConstructorAccessorImpl.newInstance(DelegatingConstructorAccessorImpl.java:45)
> k1.0.3_api       |      at java.lang.reflect.Constructor.newInstance(Constructor.java:423)
> k1.0.3_api       |      at org.glassfish.jersey.server.internal.inject.ParamConverters$StringConstructor$1._fromString(ParamConverters.java:132)
> k1.0.3_api       |      at org.glassfish.jersey.server.internal.inject.ParamConverters$AbstractStringReader.fromString(ParamConverters.java:85)
> k1.0.3_api       |      ... 79 common frames omitted

**Version of Kapua**
1.0.3

**Type of deployment**
[ ] Docker

**Main component affected**
[ ] REST API

**Additional context**

It looks like the API does things differently compared to how the front end handles device commands. 
TMPDUMP of the same command running from the front end shows the following:

> POST /file/command HTTP/1.0
> E..<. @.@..'.......@....a/.c........r......
> Ql...p..POST /file/command HTTP/1.0
> Host: ----------:80
> X-Forwarded-For: ------------
> X-Real-IP: -----------------
> Connection: close
> Content-Length: 857
> X-Forwarded-Proto: https
> X-Forwarded-Ssl: on
> X-Forwarded-Port: 443
> user-agent: Mozilla/5.0 (Windows NT 10.0; Win64; x64; rv:65.0) Gecko/20100101 Firefox/65.0
> accept: text/html,application/xhtml+xml,application/xml;q=0.9,image/webp,*/*;q=0.8
> accept-language: en-US,en;q=0.5
> accept-encoding: gzip, deflate, br
> referer: -------------------
> content-type: multipart/form-data; boundary=---------------------------31291119582383
> upgrade-insecure-requests: 1
> cookie: JSESSIONID=node01alh1kpb67ibf1i2gwr08pyidj354.node0
> 
> -----------------------------31291119582383
> Content-Disposition: form-data; name="scopeIdString"
> 
> Raz4JEnmDcs
> -----------------------------31291119582383
> Content-Disposition: form-data; name="deviceIdString"
> 
> AJIRP5jTKL0
> -----------------------------31291119582383
> Content-Disposition: form-data; name="timeout"
> 
> 60
> -----------------------------31291119582383
> Content-Disposition: form-data; name="xsrfToken"
> 
> 36a56dc5-c605-4988-97cb-9a92b35540a2
> -----------------------------31291119582383
> Content-Disposition: form-data; name="command"
> 
> lsblk
> -----------------------------31291119582383
> Content-Disposition: form-data; name="file"; filename=""
> Content-Type: application/octet-stream
> 
> 
> -----------------------------31291119582383
> Content-Disposition: form-data; name="password"
> 
> 
> -----------------------------31291119582383--
>

**Comment by gitsaycat** [comment]
Adding to the original finding:
Calling the /{scopeId}/devices/{deviceId}/configurations/{componentId} endpoint fails with the same Jersey error (Base64 decoding failed)
I'm trying to enable Jersey debugging to see which parameter its expecting - any help with doing this for docker based Kapua would be very much appreciated
Thanks!

**Comment by gitsaycat** [comment]
Another update to this topic: 
deviceRequestSend also fails with the exact same error. It seems all requests sent to devices through the API currently fail. 
Unfortunately this is also a critical requirement now in several use cases. Is there any new information on this topic?
Thanks.

**Comment by lorthirk** [comment]
So... I looked a bit around this. IMHO most of the issues comes from the REST client that you're generating via the swagger.json file. Unfortunately Swagger automatically generates the JSON file according to the return type of the methods it finds when scanning classes at startup, and can't generate correct metadata when an `@XmlJavaTypeAdapter` is used. So, just to narrow down the causes of the issue, I would kindly ask to try a cURL call or a separate client like Postman. By tracking down the specific issue in this call we could add some Swagger annotations to improve the swagger.json generation, so that your client should cope better with the API.

About the Console: unfortunately it doesn't use the REST API currently, but specific service implementations in GWT. I don't think it's a viable entry point for your case.

**Comment by gitsaycat** [comment]
Hi Claudio
Thanks for taking time to review this case.
Are you looking for the HTTP traces from the Kapua API server?
If so - I already attached the traces to the issue.

The Kapua servers are currently fronted by an nginx proxy - but all
communications between the nginx proxy and the kapua servers are in the
clear and I'm tmpdumping that.
Please let me know what else might help -
Many Thanks
Saycat

**Comment by lorthirk** [comment]
No, actually I'm not looking for them. I mean, I already looked at them, and that's the reason why I think that the issue is in the Swagger generated client: it simply sends wrong data, because the Swagger definition file contains wrong informations in it. 

By looking at it, I see some errors in the body you're submitting. I would try this one:

```
let cmdInput = {
            "timeout": 60,
            "command": "lsblk",
            "workingDir": "/"
        };
```

Most of the fields are actually coming from the fact that `DeviceCommandInput` extends from `KapuaEntity`... but it shouldn't actually be the case. Please try with this body and let me know!

**Comment by gitsaycat** [comment]
Hi @lorthirk - I tried your approach and it has not helped yet. However, I think you're right and will try to adjust things to test your idea. Will update shortly either way

**Comment by gitsaycat** [comment]
Turned on Jersey trace headers and captured another session:

> {"timeout":60,"command":"lsblk","workingDir":"/"}
> 18:11:05.166289 IP ip-172-20-0-7.ap-southeast-1.compute.internal.http-alt > ip-172-20-0-1.ap-southeast-1.compute.internal.51944: Flags [P.], seq 1:1882, ack 1367, win 249, options [nop,nop,TS val 3112589080 ecr 2166613468], length 1881: HTTP: HTTP/1.1 500 Internal Server Error
> E.....@.@.)..............(...-......_......
> ..W..#..HTTP/1.1 500 Internal Server Error
> Set-Cookie: JSESSIONID=node01w32v7f9pidx8y7wg0dqszo3v147.node0;Path=/;Expires=Thu, 01-Jan-1970 00:00:00 GMT;Max-Age=0
> Expires: Thu, 01 Jan 1970 00:00:00 GMT
> Set-Cookie: kapua-rememberme=deleteMe; Path=/; Max-Age=0; Expires=Tue, 16-Apr-2019 18:11:05 GMT
> Content-Type: application/json
> Access-Control-Allow-Origin: *
> Access-Control-Allow-Methods: GET, POST, DELETE, PUT
> Access-Control-Allow-Headers: X-Requested-With, Content-Type, Authorization
> X-Jersey-Tracing-000: START       [ ---- /  ---- ms |  ---- %] baseUri=[http://172.31.18.20:8081/v1/] requestUri=[http://172.31.18.20:8081/v1/Raz4JEnmDcs/devices/pa-test-1/requests] method=[POST] authScheme=[n/a] accept=[application/json] accept-encoding=[gzip, deflate] accept-charset=n/a accept-language=n/a content-type=[application/json] content-length=[49]
> X-Jersey-Tracing-001: PRE-MATCH   [ 0.01 /  0.16 ms |  0.13 %] PreMatchRequest summary: 1 filters
> X-Jersey-Tracing-002: MATCH       [ 0.20 /  0.37 ms |  2.38 %] RequestMatching summary
> X-Jersey-Tracing-003: REQ-FILTER  [ 0.00 /  0.39 ms |  0.03 %] Request summary: 0 filters
> X-Jersey-Tracing-004: EXCEPTION   [ 5.61 /  6.46 ms | 67.87 %] Exception mapper [org.eclipse.kapua.app.api.core.exception.ThrowableMapper @578664c3] maps [org.glassfish.jersey.server.ParamException$PathParamException @5bbfa817 <404/CLIENT_ERROR|Not Found|-no-entity->] ('HTTP 404 Not Found') to <500/SERVER_ERROR|Internal Server Error>
> X-Jersey-Tracing-005: RESP-FILTER [ 0.01 /  6.60 ms |  0.17 %] Response summary: 1 filters
> X-Jersey-Tracing-006: WI          [ 1.57 /  8.25 ms | 18.96 %] WriteTo summary: 2 interceptors
> X-Jersey-Tracing-007: FINISHED    [ ---- /  8.27 ms |  ---- %] Response status: 500/SERVER_ERROR|Internal Server Error
> Content-Length: 52
> Server: Jetty(9.4.12.v20180830)
> 
> {"httpErrorCode":500,"message":"HTTP 404 Not Found"}
> 18:11:05.166289 IP ip-172-20-0-7.ap-southeast-1.compute.internal.http-alt > ip-172-20-0-1.ap-southeast-1.compute.internal.51944: Flags [P.], seq 1:1882, ack 1367, win 249, options [nop,nop,TS val 3112589080 ecr 2166613468], length 1881: HTTP: HTTP/1.1 500 Internal Server Error
> E.....@.@.)..............(...-......_......
> ..W..#..HTTP/1.1 500 Internal Server Error
> Set-Cookie: JSESSIONID=node01w32v7f9pidx8y7wg0dqszo3v147.node0;Path=/;Expires=Thu, 01-Jan-1970 00:00:00 GMT;Max-Age=0
> Expires: Thu, 01 Jan 1970 00:00:00 GMT
> Set-Cookie: kapua-rememberme=deleteMe; Path=/; Max-Age=0; Expires=Tue, 16-Apr-2019 18:11:05 GMT
> Content-Type: application/json
> Access-Control-Allow-Origin: *
> Access-Control-Allow-Methods: GET, POST, DELETE, PUT
> Access-Control-Allow-Headers: X-Requested-With, Content-Type, Authorization
> X-Jersey-Tracing-000: START       [ ---- /  ---- ms |  ---- %] baseUri=[http://172.31.18.20:8081/v1/] requestUri=[http://172.31.18.20:8081/v1/Raz4JEnmDcs/devices/pa-test-1/requests] method=[POST] authScheme=[n/a] accept=[application/json] accept-encoding=[gzip, deflate] accept-charset=n/a accept-language=n/a content-type=[application/json] content-length=[49]
> X-Jersey-Tracing-001: PRE-MATCH   [ 0.01 /  0.16 ms |  0.13 %] PreMatchRequest summary: 1 filters
> X-Jersey-Tracing-002: MATCH       [ 0.20 /  0.37 ms |  2.38 %] RequestMatching summary
> X-Jersey-Tracing-003: REQ-FILTER  [ 0.00 /  0.39 ms |  0.03 %] Request summary: 0 filters
> X-Jersey-Tracing-004: EXCEPTION   [ 5.61 /  6.46 ms | 67.87 %] Exception mapper [org.eclipse.kapua.app.api.core.exception.ThrowableMapper @578664c3] maps [org.glassfish.jersey.server.ParamException$PathParamException @5bbfa817 <404/CLIENT_ERROR|Not Found|-no-entity->] ('HTTP 404 Not Found') to <500/SERVER_ERROR|Internal Server Error>
> X-Jersey-Tracing-005: RESP-FILTER [ 0.01 /  6.60 ms |  0.17 %] Response summary: 1 filters
> X-Jersey-Tracing-006: WI          [ 1.57 /  8.25 ms | 18.96 %] WriteTo summary: 2 interceptors
> X-Jersey-Tracing-007: FINISHED    [ ---- /  8.27 ms |  ---- %] Response status: 500/SERVER_ERROR|Internal Server Error
> Content-Length: 52
> Server: Jetty(9.4.12.v20180830)
> 
> {"httpErrorCode":500,"message":"HTTP 404 Not Found"}
>

**Comment by lorthirk** [comment]
I see a 404. Can you post the full URI?

**Comment by gitsaycat** [comment]
Hi @lorthirk - 
Here is an excerpt of the log that shows the URL - 

`Access-Control-Allow-Origin: *
Access-Control-Allow-Methods: GET, POST, DELETE, PUT
Access-Control-Allow-Headers: X-Requested-With, Content-Type, Authorization
X-Jersey-Tracing-000: START [ ---- / ---- ms | ---- %] baseUri=[http://172.31.18.20:8081/v1/] **requestUri=[http://172.31.18.20:8081/v1/Raz4JEnmDcs/devices/pa-test-1/requests**] method=[POST] authScheme=[n/a] accept=[application/json] accept-encoding=[gzip, deflate] accept-charset=n/a accept-language=n/a content-type=[application/json] content-length=[49]
X-Jersey-`

However, I don't think technically its an actual 404 - I think its very much a problem with the swagger meta data being incomplete. 
Thanks, Gitsaycat

**Comment by lorthirk** [comment]
Please look at my previous comment :smile:

**Comment by gitsaycat** [comment]
Hi @lorthirk 
Thank you for spotting that one! Should've spotted that long back. However, now I'm trying to figure out why I'm seeing the following:

`Internal Exception: org.h2.jdbc.JdbcSQLException: Numeric value out of range: "-1605234824608862408715148495145"; SQL statement:
SELECT DISTINCT t1.accept_encoding, t1.app_framework_version, t1.app_identifiers, t1.attributes, t1.bios_version, t1.client_id, t1.connection_interface, t1.connection_ip, t1.created_on, t1.custom_attribute_1, t1.custom_attribute_2, t1.custom_attribute_3, t1.custom_attribute_4, t1.custom_attribute_5, t1.display_name, t1.firmware_version, t1.iccid, t1.imei, t1.imsi, t1.jvm_version, t1.model_id, t1.model_name, t1.modified_on, t1.optlock, t1.os_version, t1.osgi_framework_version, t1.properties, t1.serial_number, t1.status, t1.connection_id, t1.created_by, t1.group_id, t1.id, t1.last_event_id, t1.modified_by, t1.scope_id, t0.allow_user_change, t0.attributes, t0.client_id, t0.client_ip, t0.created_on, t0.modified_on, t0.optlock, t0.properties, t0.protocol, t0.server_ip, t0.status, t0.user_coupling_mode, t0.created_by, t0.id, t0.modified_by, t0.reserved_user_id, t0.scope_id, t0.user_id, t2.action, t2.created_on, t2.event_message, t2.received_on, t2.resource, t2.response_code, t2.sent_on, t2.created_by, t2.device_id, t2.id, t2.pos_altitude, t2.pos_heading, t2.pos_latitude, t2.pos_longitude, t2.pos_precision, t2.pos_satellites, t2.pos_speed, t2.pos_status, t2.pos_timestamp, t2.scope_id FROM     dvc_device t1 LEFT OUTER JOIN dvc_device_connection t0 ON (t0.id = t1.connection_id) LEFT OUTER JOIN dvc_device_event t2 ON (t2.id = t1.last_event_id)  WHERE ((t1.scope_id = ?) AND (t1.id = ?)) ORDER BY t1.client_id ASC [22003-193]
        at org.h2.message.DbException.getJdbcSQLException(DbException.java:345)
        at org.h2.message.DbException.get(DbException.java:179)
        at org.h2.message.DbException.get(DbException.java:155)
        at org.h2.value.Value.convertToLong(Value.java:1087)
        at org.h2.value.Value.convertTo(Value.java:645)
        at org.h2.mvstore.db.MVPrimaryIndex.getKey(MVPrimaryIndex.java:338)
        at org.h2.mvstore.db.MVDelegateIndex.find(MVDelegateIndex.java:69)
        at org.h2.index.BaseIndex.find(BaseIndex.java:128)
        at org.h2.index.IndexCursor.find(IndexCursor.java:169)
        at org.h2.table.TableFilter.next(TableFilter.java:467)
        at org.h2.command.dml.Select.queryFlat(Select.java:542)
        at org.h2.command.dml.Select.queryWithoutCache(Select.java:655)
        at org.h2.command.dml.Query.query(Query.java:341)
        at org.h2.command.dml.Query.query(Query.java:309)
        at org.h2.command.dml.Query.query(Query.java:36)
        at org.h2.command.CommandContainer.query(CommandContainer.java:110)
        at org.h2.command.Command.executeQuery(Command.java:201)
        at org.h2.server.TcpServerThread.process(TcpServerThread.java:319)
        at org.h2.server.TcpServerThread.run(TcpServerThread.java:158)
        at java.lang.Thread.run(Thread.java:748)

Error Code: 22003
Call: SELECT DISTINCT t1.accept_encoding, t1.app_framework_version, t1.app_identifiers, t1.attributes, t1.bios_version, t1.client_id, t1.connection_interface, t1.connection_ip, t1.created_on, t1.custom_attribute_1, t1.custom_attribute_2, t1.custom_attribute_3, t1.custom_attribute_4, t1.custom_attribute_5, t1.display_name, t1.firmware_version, t1.iccid, t1.imei, t1.imsi, t1.jvm_version, t1.model_id, t1.model_name, t1.modified_on, t1.optlock, t1.os_version, t1.osgi_framework_version, t1.properties, t1.serial_number, t1.status, t1.connection_id, t1.created_by, t1.group_id, t1.id, t1.last_event_id, t1.modified_by, t1.scope_id, t0.allow_user_change, t0.attributes, t0.client_id, t0.client_ip, t0.created_on, t0.modified_on, t0.optlock, t0.properties, t0.protocol, t0.server_ip, t0.status, t0.user_coupling_mode, t0.created_by, t0.id, t0.modified_by, t0.reserved_user_id, t0.scope_id, t0.user_id, t2.action, t2.created_on, t2.event_message, t2.received_on, t2.resource, t2.response_code, t2.sent_on, t2.created_by, t2.device_id, t2.id, t2.pos_altitude, t2.pos_heading, t2.pos_latitude, t2.pos_longitude, t2.pos_precision, t2.pos_satellites, t2.pos_speed, t2.pos_status, t2.pos_timestamp, t2.scope_id FROM {oj dvc_device t1 LEFT OUTER JOIN dvc_device_connection t0 ON (t0.id = t1.connection_id) LEFT OUTER JOIN dvc_device_event t2 ON (t2.id = t1.last_event_id)} WHERE ((t1.scope_id = ?) AND (t1.id = ?)) ORDER BY t1.client_id ASC
        bind => [5020660519353585099, -1605234824608862408715148495145]
Query: ReadAllQuery(referenceClass=DeviceImpl sql="SELECT DISTINCT t1.accept_encoding, t1.app_framework_version, t1.app_identifiers, t1.attributes, t1.bios_version, t1.client_id, t1.connection_interface, t1.connection_ip, t1.created_on, t1.custom_attribute_1, t1.custom_attribute_2, t1.custom_attribute_3, t1.custom_attribute_4, t1.custom_attribute_5, t1.display_name, t1.firmware_version, t1.iccid, t1.imei, t1.imsi, t1.jvm_version, t1.model_id, t1.model_name, t1.modified_on, t1.optlock, t1.os_version, t1.osgi_framework_version, t1.properties, t1.serial_number, t1.status, t1.connection_id, t1.created_by, t1.group_id, t1.id, t1.last_event_id, t1.modified_by, t1.scope_id, t0.allow_user_change, t0.attributes, t0.client_id, t0.client_ip, t0.created_on, t0.modified_on, t0.optlock, t0.properties, t0.protocol, t0.server_ip, t0.status, t0.user_coupling_mode, t0.created_by, t0.id, t0.modified_by, t0.reserved_user_id, t0.scope_id, t0.user_id, t2.action, t2.created_on, t2.event_message, t2.received_on, t2.resource, t2.response_code, t2.sent_on, t2.created_by, t2.device_id, t2.id, t2.pos_altitude, t2.pos_heading, t2.pos_latitude, t2.pos_longitude, t2.pos_precision, t2.pos_satellites, t2.pos_speed, t2.pos_status, t2.pos_timestamp, t2.scope_id FROM {oj dvc_device t1 LEFT OUTER JOIN dvc_device_connection t0 ON (t0.id = t1.connection_id) LEFT OUTER JOIN dvc_device_event t2 ON (t2.id = t1.last_event_id)} WHERE ((t1.scope_id = ?) AND (t1.id = ?)) ORDER BY t1.client_id ASC")
13:34:23.288 [qtp913190639-12] ERROR o.e.k.a.a.c.e.KapuaExceptionMapper - Generic Kapua exception!
org.eclipse.kapua.KapuaException: An internal error occurred: Error while searching groupId.
        at org.eclipse.kapua.KapuaException.internalError(KapuaException.java:123)
        at org.eclipse.kapua.service.device.registry.common.DeviceValidation.findCurrentGroupId(DeviceValidation.java:248)
        at org.eclipse.kapua.service.device.registry.common.DeviceValidation.validateFindPreconditions(DeviceValidation.java:160)
        at org.eclipse.kapua.service.device.registry.internal.DeviceRegistryServiceImpl.find(DeviceRegistryServiceImpl.java:99)
        at org.eclipse.kapua.service.device.registry.internal.DeviceRegistryServiceImpl.find(DeviceRegistryServiceImpl.java:44)
        at org.eclipse.kapua.service.device.management.commons.call.DeviceCallExecutor.send(DeviceCallExecutor.java:85)
        at org.eclipse.kapua.service.device.management.command.internal.DeviceCommandManagementServiceImpl.exec(DeviceCommandManagementServiceImpl.java:92)
        at org.eclipse.kapua.app.api.resources.v1.resources.DeviceManagementCommands.sendCommand(DeviceManagementCommands.java:90)
        at sun.reflect.NativeMethodAccessorImpl.invoke0(Native Method)
        at sun.reflect.NativeMethodAccessorImpl.invoke(NativeMethodAccessorImpl.java:62)
        at sun.reflect.DelegatingMethodAccessorImpl.invoke(DelegatingMethodAccessorImpl.java:43)
        at java.lang.reflect.Method.invoke(Method.java:498)
        at org.glassfish.jersey.server.model.internal.ResourceMethodInvocationHandlerFactory$1.invoke(ResourceMethodInvocationHandlerFactory.java:81)
        at org.glassfish.jersey.server.model.internal.AbstractJavaResourceMethodDispatcher$1.run(AbstractJavaResourceMethodDispatcher.java:144)
        at org.glassfish.jersey.server.model.internal.AbstractJavaResourceMethodDispatcher.invoke(AbstractJavaResourceMethodDispatcher.java:161)
        at org.glassfish.jersey.server.model.internal.JavaResourceMethodDispatcherProvider$TypeOutInvoker.doDispatch(JavaResourceMethodDispatcherProvider.java:205)
        at org.glassfish.`

**Comment by Coduz** [comment]
Hi @gitsaycat ,

looking at the error message and the JPA query it seems like that the `device.id` used to query is too big. 

Which id you have on the database?

Regards, 

_Alberto_

**Comment by gitsaycat** [comment]
Hi @lorthirk 
Indeed that looks to be the case, but cannot figure out where the larger number is coming from. The following is the point where the bind values are printed out:

= ?) AND (t1.id = ?)) ORDER BY t1.client_id ASC
**bind => [5020660519353585099, -1605234824608862408715148495145]**
Query: ReadAllQuery(referenceClass=DeviceImpl sql="SELECT DISTINCT t1.accept_encoding, t1.app_frame

I see the deviceId as the first one which is right. But the scopeId is huge and not what went in from the front end. Also the scopeId is a string - is there some implicit conversion happening?

Thanks, Gitsaycat

**Comment by gitsaycat** [comment]
> 
> 
> I see a 404. Can you post the full URI?
> 
> EDIT: nevermind, I see the full URI in the trace. The URI you're using is `http://172.31.18.20:8081/v1/Raz4JEnmDcs/devices/pa-test-1/requests`, so you're using the Client ID to target the device. You have to use the Device ID instead.

Hi @lorthirk 
An observation on this though:
We have been using clientId and deviceId interchangeably - which is obviously bad. However, the following code seems to work fine with clientId - we will test our code again but it would be good to have your thoughts on this confusion: 

> var opts = { 
          'clientId': deviceId, // "pa-test-1", // String | The client id to filter results
          'channel': channel, // String | The channel to filter results.
          'strictChannel': true, // Boolean | Restrict the search only to this channel ignoring its children. Only meaningful if channel is set.
          'startDate': startDate, //"2019-02-12T19:04:32.616Z", // String | The start date to filter the results. Must come before endDate parameter
          'endDate': endDate, //"2019-02-14T19:04:32.616Z", // String | The end date to filter the results. Must come after startDate parameter
          'metricName': fieldName, // String | The metric name to filter results
          'metricType': "", // String | The metric type to filter results
          'metricMin': valgt, // String | The min metric value to filter results
          'metricMax': vallt, // String | The max metric value to filter results
          'offset': offset, // Integer | The result set offset
          'limit': itemCount // Integer | The result set limit
        };
        
        var callback =         
        function(error, data, response) {
            if (error) {
                node.error(error);
            } else {
                let dataAsString = JSON.stringify(data);
                node.trace("Received data:" + dataAsString);
                let dataObj = JSON.parse(dataAsString.trim());
                //node.warn(dataObj);
                let metricsArray = [];
                let items = dataObj.items;
                for (let i = 0; i < items.length; ++i) {
                    let capturedOn = items[i].capturedOn;
                    let index = 0;

                    for (;;) {
                        if (!items[i].payload.metrics[index]) {
                            break;
                        }
                        //node.warn("=================" + items[i].payload.metrics[index].name + "?" + rawFldName);
                        if (items[i].payload.metrics[index].name === rawFldName) {
                            let value = items[i].payload.metrics[index].value;
                            metricsArray.push({'capturedOn': capturedOn, 'value': value});
                        }
                        ++index;
                    }
                }
                
                msg.payload = metricsArray;
                node.send(msg);
            }
        };
        messagesApi.dataMessageSimpleQuery(accessToken.scopeId, opts, callback);

**Comment by lorthirk** [comment]
Unfortunately this is one of the cases where our docs is a bit misleading. The one and only way to target a device is by using the Device ID in the path of the API request. Any field you enter in the JSON body for that purpose (so, both `deviceId` and `clientId`) is actually ignored.

**Comment by gitsaycat** [comment]
Hi @lorthirk 
This is clear - and it explains why it was working before and not for the device related APIs.
However, with the URL corrected now with deviceId we get a the new JDBC exceptions:

**HTTP Log**
> 
10:05:53.632220 IP ip-172-20-0-1.ap-southeast-1.compute.internal.48690 > ip-172-20-0-7.ap-southeast-1.compute.internal.http-alt: Flags [P.], seq 0:1325, ack 1, win 229, options [nop,nop,TS val 2310306146 ecr 3256277325], length 1325: HTTP: GET /v1/Raz4JEnmDcs/devices/5020660519353585099/configurations?timeout=789 HTTP/1.0
E..a0<@.@..*.........2....oz..9.....]......
..yb...MGET /v1/Raz4JEnmDcs/devices/5020660519353585099/configurations?timeout=789 HTTP/1.0
X-Jersey-Tracing-Accept: true
X-Jersey-Tracing-Threshold: SUMMARY

> 
Error Code: 22003
Call: SELECT DISTINCT t1.accept_encoding, t1.app_framework_version, t1.app_identifiers, t1.attributes, t1.bios_version, t1.client_id, t1.connection_interface, t1.connection_ip, t1.created_on, t1.custom_attribute_1, t1.custom_attribute_2, t1.custom_attribute_3, t1.custom_attribute_4, t1.custom_attribute_5, t1.display_name, t1.firmware_version, t1.iccid, t1.imei, t1.imsi, t1.jvm_version, t1.model_id, t1.model_name, t1.modified_on, t1.optlock, t1.os_version, t1.osgi_framework_version, t1.properties, t1.serial_number, t1.status, t1.connection_id, t1.created_by, t1.group_id, t1.id, t1.last_event_id, t1.modified_by, t1.scope_id, t0.allow_user_change, t0.attributes, t0.client_id, t0.client_ip, t0.created_on, t0.modified_on, t0.optlock, t0.properties, t0.protocol, t0.server_ip, t0.status, t0.user_coupling_mode, t0.created_by, t0.id, t0.modified_by, t0.reserved_user_id, t0.scope_id, t0.user_id, t2.action, t2.created_on, t2.event_message, t2.received_on, t2.resource, t2.response_code, t2.sent_on, t2.created_by, t2.device_id, t2.id, t2.pos_altitude, t2.pos_heading, t2.pos_latitude, t2.pos_longitude, t2.pos_precision, t2.pos_satellites, t2.pos_speed, t2.pos_status, t2.pos_timestamp, t2.scope_id FROM {oj dvc_device t1 LEFT OUTER JOIN dvc_device_connection t0 ON (t0.id = t1.connection_id) LEFT OUTER JOIN dvc_device_event t2 ON (t2.id = t1.last_event_id)} WHERE ((t1.scope_id = ?) AND (t1.id = ?)) ORDER BY t1.client_id ASC
        bind => [5020660519353585099, -500903679360321534241674963069985]
Query: ReadAllQuery(referenceClass=DeviceImpl sql="SELECT DISTINCT t1.accept_encoding, t1.app_framework_version, t1.app_identifiers, t1.attributes, t1.bios_version, t1.client_id, t1.connection_interface, t1.connection_ip, t1.created_on, t1.custom_attribute_1, t1.custom_attribute_2, t1.custom_attribute_3, t1.custom_attribute_4, t1.custom_attribute_5, t1.display_name, t1.firmware_version, t1.iccid, t1.imei, t1.imsi, t1.jvm_version, t1.model_id, t1.model_name, t1.modified_on, t1.optlock, t1.os_version, t1.osgi_framework_version, t1.properties, t1.serial_number, t1.status, t1.connection_id, t1.created_by, t1.group_id, t1.id, t1.last_event_id, t1.modified_by, t1.scope_id, t0.allow_user_change, t0.attributes, t0.client_id, t0.client_ip, t0.created_on, t0.modified_on, t0.optlock, t0.properties, t0.protocol, t0.server_ip, t0.status, t0.user_coupling_mode, t0.created_by, t0.id, t0.modified_by, t0.reserved_user_id, t0.scope_id, t0.user_id, t2.action, t2.created_on, t2.event_message, t2.received_on, t2.resource, t2.response_code, t2.sent_on, t2.created_by, t2.device_id, t2.id, t2.pos_altitude, t2.pos_heading, t2.pos_latitude, t2.pos_longitude, t2.pos_precision, t2.pos_satellites, t2.pos_speed, t2.pos_status, t2.pos_timestamp, t2.scope_id FROM {oj dvc_device t1 LEFT OUTER JOIN dvc_device_connection t0 ON (t0.id = t1.connection_id) LEFT OUTER JOIN dvc_device_event t2 ON (t2.id = t1.last_event_id)} WHERE ((t1.scope_id = ?) AND (t1.id = ?)) ORDER BY t1.client_id ASC")
        at org.eclipse.persistence.exceptions.DatabaseException.sqlException(DatabaseException.java:340)
        at org.eclipse.persistence.internal.databaseaccess.DatabaseAccessor.basicExecuteCall(DatabaseAccessor.java:684)
        at org.eclipse.persistence.internal.databaseaccess.DatabaseAccessor.executeCall(DatabaseAccessor.java:560)
        at org.eclipse.persistence.internal.sessions.AbstractSession.basicExecuteCall(AbstractSession.java:2056)
        at org.eclipse.persistence.sessions.server.ServerSession.executeCall(ServerSession.java:570)
        at org.eclipse.persistence.sessions.server.ClientSession.executeCall(ClientSession.java:258)
        at org.eclipse.persistence.internal.queries.DatasourceCallQueryMechanism.executeCall(DatasourceCallQueryMechanism.java:242)
        at org.eclipse.persistence.internal.queries.DatasourceCallQueryMechanism.executeCall(DatasourceCallQueryMechanism.java:228)
        at org.eclipse.persistence.internal.queries.DatasourceCallQueryMechanism.executeSelectCall(DatasourceCallQueryMechanism.java:299)
        at org.eclipse.persistence.internal.queries.DatasourceCallQueryMechanism.selectAllRows(DatasourceCallQueryMechanism.java:694)
        at org.eclipse.persistence.internal.queries.ExpressionQueryMechanism.selectAllRowsFromTable(ExpressionQueryMechanism.java:2740)
        at org.eclipse.persistence.internal.queries.ExpressionQueryMechanism.selectAllRows(ExpressionQueryMechanism.java:2693)
        at org.eclipse.persistence.queries.ReadAllQuery.executeObjectLevelReadQuery(ReadAllQuery.java:559)
        at org.eclipse.persistence.queries.ObjectLevelReadQuery.executeDatabaseQuery(ObjectLevelReadQuery.java:1175)
        at org.eclipse.persistence.queries.DatabaseQuery.execute(DatabaseQuery.java:904)
        at org.eclipse.persistence.queries.ObjectLevelReadQuery.execute(ObjectLevelReadQuery.java:1134)
        at org.eclipse.persistence.queries.ReadAllQuery.execute(ReadAllQuery.java:460)
        at org.eclipse.persistence.queries.ObjectLevelReadQuery.executeInUnitOfWork(ObjectLevelReadQuery.java:1222)
        at org.eclipse.persistence.internal.sessions.UnitOfWorkImpl.internalExecuteQuery(UnitOfWorkImpl.java:2896)
        at org.eclipse.persistence.internal.sessions.AbstractSession.executeQuery(AbstractSession.java:1857)
        at org.eclipse.persistence.internal.sessions.AbstractSession.executeQuery(AbstractSession.java:1839)
        at org.eclipse.persistence.internal.sessions.AbstractSession.executeQuery(AbstractSession.java:1804)
        at org.eclipse.persistence.internal.jpa.QueryImpl.executeReadQuery(QueryImpl.java:258)
        ... 96 common frames omitted
Caused by: org.h2.jdbc.JdbcSQLException: Numeric value out of range: "-500903679360321534241674963069985"; SQL statement:

As mentioned earlier - note that we are not sending this large number which seems to be causing the problem

**Comment by lorthirk** [comment]
The big number is coming from the `scopeId`, which is a `BigInteger` composed by the bytes resulting from decoding the stringified version (`Raz4JEnmDcs` in this case) from Base64. Perhaps you're sending something else instead of the correct `scopeId`?

**Comment by gitsaycat** [comment]
Thanks @lorthirk, you've almost got me across the finish line here :)
Scope ID is the account Id if I understand things. So now I've replaced the scopeId and deviceId the correct values so that I can see that the HTTP dump looks correct:

**POST /v1/5020660519353585099/devices/670039578401799214/commands/_execute HTTP/1.0**

But in the api server stack trace there are still some exceptions:

> 13:51:11.094 [qtp913190639-14] INFO  o.e.k.s.a.s.AuthenticationServiceShiroImpl - Login for thread '14' - 'qtp913190639-14' - 'org.apache.shiro.web.subject.support.WebDelegatingSubject@30a95c4c'
> 13:51:15.358 [qtp913190639-18] WARN  eclipselink.logging.all - Exception [EclipseLink-4002] (Eclipse Persistence Services - 2.6.3.v20160428-59c81c5): org.eclipse.persistence.exceptions.DatabaseException
> Internal Exception: org.h2.jdbc.JdbcSQLException: Numeric value out of range: "-500903679360321534241674963069985"; SQL statement:
> SELECT attributes, created_on, expiration_date, modified_on, name, optlock, parent_account_path, properties, created_by, id, modified_by, org_address_line_1, org_address_line_2, org_address_line_3, org_city, org_country, org_email, org_name, org_person_name, org_phone_number, org_state_province_county, org_zip_postcode, scope_id FROM act_account WHERE (id = ?) [22003-193]
>         at org.h2.message.DbException.getJdbcSQLException(DbException.java:345)
>         at org.h2.message.DbException.get(DbException.java:179)
>         at org.h2.message.DbException.get(DbException.java:155)
>         at org.h2.value.Value.convertToLong(Value.java:1087)
>         at org.h2.value.Value.convertTo(Value.java:645)
>         at org.h2.mvstore.db.MVSecondaryIndex.convertToKey(MVSecondaryIndex.java:322)
>         at org.h2.mvstore.db.MVSecondaryIndex.find(MVSecondaryIndex.java:258)
>         at org.h2.mvstore.db.MVSecondaryIndex.find(MVSecondaryIndex.java:254)
>         at org.h2.index.BaseIndex.find(BaseIndex.java:128)
>         at org.h2.index.IndexCursor.find(IndexCursor.java:169)
>         at org.h2.table.TableFilter.next(TableFilter.java:467)
>         at org.h2.command.dml.Select.queryFlat(Select.java:542)
>         at org.h2.command.dml.Select.queryWithoutCache(Select.java:655)
>         at org.h2.command.dml.Query.query(Query.java:341)
>         at org.h2.command.dml.Query.query(Query.java:309)
>         at org.h2.command.dml.Query.query(Query.java:36)
>         at org.h2.command.CommandContainer.query(CommandContainer.java:110)
>         at org.h2.command.Command.executeQuery(Command.java:201)
>         at org.h2.server.TcpServerThread.process(TcpServerThread.java:319)
>         at org.h2.server.TcpServerThread.run(TcpServerThread.java:158)
>         at java.lang.Thread.run(Thread.java:748)
> 
> Error Code: 22003
> Call: SELECT attributes, created_on, expiration_date, modified_on, name, optlock, parent_account_path, properties, created_by, id, modified_by, org_address_line_1, org_address_line_2, org_address_line_3, org_city, org_country, org_email, org_name, org_person_name, org_phone_number, org_state_province_county, org_zip_postcode, scope_id FROM act_account WHERE (id = ?)
>         bind => [-500903679360321534241674963069985]
> Query: ReadObjectQuery(name="readAccountImpl" referenceClass=AccountImpl sql="SELECT attributes, created_on, expiration_date, modified_on, name, optlock, parent_account_path, properties, created_by, id, modified_by, org_address_line_1, org_address_line_2, org_address_line_3, org_city, org_country, org_email, org_name, org_person_name, org_phone_number, org_state_province_county, org_zip_postcode, scope_id FROM act_account WHERE (id = ?)")
> 13:51:15.359 [qtp913190639-18] ERROR o.e.k.a.a.c.e.ThrowableMapper - Severe error!
> org.eclipse.kapua.KapuaRuntimeException: An internal error occurred: Error while forwarding permission: device_management:execute:-500903679360321534241674963069985:*.
>         at org.eclipse.kapua.KapuaRuntimeException.internalError(KapuaRuntimeException.java:118)
>         at org.eclipse.kapua.service.authorization.permission.shiro.PermissionImpl.forwardPermission(PermissionImpl.java:278)
>         at org.eclipse.kapua.service.authorization.permission.shiro.PermissionImpl.implies(PermissionImpl.java:230)
>         at org.apache.shiro.realm.AuthorizingRealm.isPermitted(AuthorizingRealm.java:471)
>         at org.apache.shiro.realm.AuthorizingRealm.isPermitted(AuthorizingRealm.java:463)
>  

Not sure if the authorization error is a result of the incorrect decoding to a big number or is the cause of it all?

Thanks Gitsaycat

**Comment by lorthirk** [comment]
Yes, `scopeId` is the ID of the account in which the REST call will operate.

The `scopeId` and the `deviceId` MUST be supplied in their stringified version, because they WILL be decoded from Base64.

**Comment by gitsaycat** [comment]
Hi @lorthirk - the attached file is a screen shot of my elasticsearch browser - I just highlighted a single document - from there I can see:
ScopeId  = 5020660519353585099
DeviceId = 670039578401799214

I was using the values directly in the API - is that incorrect?
Thanks, Gitsaycat


![elastic](https://user-images.githubusercontent.com/14805543/56427921-30afa000-62f0-11e9-9a1f-3d27e22b8dfd.jpg)

**Comment by lorthirk** [comment]
So you're extracting the scopeId from a message in the datastore, and using that value to issue a request via REST to the same device? Is this correct?

**Comment by gitsaycat** [comment]
Actually I have the scopeId already extracted using the Accounts API. 
But yes - I could do it that way as well. Essentially if:

```
var devicesApi = new apiclient.DevicesApi();
        var deviceId = "NjcwMDM5NTc4NDAxNzk5MjE0";
        var scopeId = "NTAyMDY2MDUxOTM1MzU4NTA5OQ==";
        //var cmdInput = new apiclient.DeviceCommandInput(); // DeviceCommandInput | The input command
        //cmdInput.command = "lsblk";
        
        let cmdInput = {
            //"environment": [],//["string"],
            "timeout": 60,
            //"password": null,
            //"arguments": [],//["string"],
            //"body": null,//["string"],
            "command": "lsblk",
            "workingDir": "/",
            //"runAsynch": false,
            //"stdin": null,
            "scopeId": scopeId,
            //"id": "string",
            //"createdBy": "api",
            //"type": "string"
        };

/*
        let cmdInput = {
            "timeout": 60,
            "command": "lsblk",
            "workingDir": "/",
        };
  */
        //let opts = null;//cmdInput;

        var opts = { 
          'timeout': 60 // Integer | The timeout of the command execution
        };
        
        var callback = 
        function(error, data, response) {
            if (error) {
                console.error(error);
            } else {
                console.log('Cmd successfully executed on device. Returned data: ' + JSON.stringify(data));
            }
        };
        devicesApi.deviceCommandExecute(scopeId, deviceId, cmdInput, callback);        
```

HTTP trace shows the following URL being used by Kapua internally:

> POST /v1/NTAyMDY2MDUxOTM1MzU4NTA5OQ==/devices/NjcwMDM5NTc4NDAxNzk5MjE0/commands/_execute HTTP/1.0
> E...:.@.@..>.............A..{.A.....^......
> ...{.   .fPOST /v1/NTAyMDY2MDUxOTM1MzU4NTA5OQ==/devices/NjcwMDM5NTc4NDAxNzk5MjE0/commands/_execute HTTP/1.0
> X-Jersey-Tracing-Accept: true
>

**Comment by lorthirk** [comment]
Because the id it's not the Base64 of the string representation of the number, but rather than the values of its bytes.

I'm sorry, but I'm more and more confused. Could you please explain what you're trying to do from an high level perspective?

**Comment by gitsaycat** [comment]
Sure - I'm trying to use the Javascript API geenrated by Swagger to send a command to a device.
I have the deviceId and the scopeId required from messages in EL
I tried using the values directly - that did not work and I think you're saying that I should not use the base64 encoded values of the strings as well --  which makes sense. 

Would it be: **base64Encode( scopeIdStringValue.getBytes() )** ?

**Comment by lorthirk** [comment]
Exactly. You can see that in `KapuaEid`

https://github.com/eclipse/kapua/blob/6695c548a1b6e197600c161d732f8d6362b0384d/commons/src/main/java/org/eclipse/kapua/commons/model/id/KapuaEid.java#L70

And in `KapuaId`

https://github.com/eclipse/kapua/blob/6695c548a1b6e197600c161d732f8d6362b0384d/service/api/src/main/java/org/eclipse/kapua/model/id/KapuaId.java#L48

As you can see the conversion is made with the bytes themselves, not the string representation

**Comment by gitsaycat** [comment]
Getting there:
Need to conform in Javascript to the java.lang.BigInteger toByteArray() output and also once Base64 encoding is done - padding needs to be removed. 

But now new exceptions:

> 16:43:49.761 [qtp913190639-16] ERROR o.e.k.a.a.c.e.KapuaExceptionMapper - Generic Kapua exception!
> org.eclipse.kapua.service.device.call.kura.exception.KuraMqttDeviceCallException: Error:
>         at org.eclipse.kapua.service.device.call.kura.KuraDeviceCallImpl.send(KuraDeviceCallImpl.java:137)
>         at org.eclipse.kapua.service.device.call.kura.KuraDeviceCallImpl.execute(KuraDeviceCallImpl.java:73)
>         at org.eclipse.kapua.service.device.call.kura.KuraDeviceCallImpl.execute(KuraDeviceCallImpl.java:43)
>         at org.eclipse.kapua.service.device.management.commons.call.DeviceCallExecutor.send(DeviceCallExecutor.java:129)
>         at org.eclipse.kapua.service.device.management.command.internal.DeviceCommandManagementServiceImpl.exec(DeviceCommandManagementServiceImpl.java:92)
>         at org.eclipse.kapua.app.api.resources.v1.resources.DeviceManagementCommands.sendCommand(DeviceManagementCommands.java:90)
>         at sun.reflect.GeneratedMethodAccessor318.invoke(Unknown Source)
>         at sun.reflect.DelegatingMethodAccessorImpl.invoke(DelegatingMethodAccessorImpl.java:43)
>         at java.lang.reflect.Method.invoke(Method.java:498)
>         at org.glassfish.jersey.server.model.internal.ResourceMethodInvocationHandlerFactory$1.invoke(ResourceMethodInvocationHandlerFactory.java:81)
>         at org.glassfish.jersey.server.model.internal.AbstractJavaResourceMethodDispatcher$1.run(AbstractJavaResourceMethodDispatcher.java:144)
>         at org.glassfish.jersey.server.model.internal.AbstractJavaResourceMethodDispatcher.invoke(AbstractJavaResourceMethodDispatcher.java:161)
>         at org.glassfish.jersey.server.model.internal.JavaResourceMethodDispatcherProvider$TypeOutInvoker.doDispatch(JavaResourceMethodDispatcherProvider.java:205)
>         at org.glassfish.jersey.server.model.internal.AbstractJavaResourceMethodDispatcher.dispatch(AbstractJavaResourceMethodDispatcher.java:99)
>         at org.glassfish.jersey.server.model.ResourceMethodInvoker.invoke(ResourceMethodInvoker.java:389)
>         at org.glassfish.jersey.server.model.ResourceMethodInvoker.apply(ResourceMethodInvoker.java:347)
>         at org.glassfish.jersey.server.model.ResourceMethodInvoker.apply(ResourceMethodInvoker.java:102)
>         at org.glassfish.jersey.server.ServerRuntime$2.run(ServerRuntime.java:326)
>         at org.glassfish.jersey.internal.Errors$1.call(Errors.java:271)
>         at org.glassfish.jersey.internal.Errors$1.call(Errors.java:267)
>         at org.glassfish.jersey.internal.Errors.process(Errors.java:315)
>         at org.glassfish.jersey.internal.Errors.process(Errors.java:297)
>         at org.glassfish.jersey.internal.Errors.process(Errors.java:267)
>         at org.glassfish.jersey.process.internal.RequestScope.runInScope(RequestScope.java:317)
>         at org.glassfish.jersey.server.ServerRuntime.process(ServerRuntime.java:305)
>         at org.glassfish.jersey.server.ApplicationHandler.handle(ApplicationHandler.java:1154)
>         at org.glassfish.jersey.servlet.WebComponent.serviceImpl(WebComponent.java:473)
>         at org.glassfish.jersey.servlet.WebComponent.service(WebComponent.java:427)
>         at org.glassfish.jersey.servlet.ServletContainer.service(ServletContainer.java:388)
>         at org.glassfish.jersey.servlet.ServletContainer.service(ServletContainer.java:341)
>         at org.glassfish.jersey.servlet.ServletContainer.service(ServletContainer.java:228)
>         at org.eclipse.jetty.servlet.ServletHolder.handle(ServletHolder.java:865)
>         at org.eclipse.jetty.servlet.ServletHandler$CachedChain.doFilter(ServletHandler.java:1655)
>         at org.eclipse.jetty.websocket.server.WebSocketUpgradeFilter.doFilter(WebSocketUpgradeFilter.java:215)
>         at org.eclipse.jetty.servlet.ServletHandler$CachedChain.doFilter(ServletHandler.java:1642)
>         at org.apache.shiro.web.servlet.ProxiedFilterChain.doFilter(ProxiedFilterChain.java:61)
>         at org.apache.shiro.web.servlet.AdviceFilter.executeChain(AdviceFilter.java:108)
>         at org.apache.shiro.web.servlet.AdviceFilter.doFilterInternal(AdviceFilter.java:137)
>         at org.apache.shiro.web.servlet.OncePerRequestFilter.doFilter(OncePerRequestFilter.java:125)
>         at org.apache.shiro.web.servlet.ProxiedFilterChain.doFilter(ProxiedFilterChain.java:66)
>         at org.apache.shiro.web.servlet.AdviceFilter.executeChain(AdviceFilter.java:108)
>         at org.apache.shiro.web.servlet.AdviceFilter.doFilterInternal(AdviceFilter.java:137)
>         at org.apache.shiro.web.servlet.OncePerRequestFilter.doFilter(OncePerRequestFilter.java:125)
>         at org.apache.shiro.web.servlet.ProxiedFilterChain.doFilter(ProxiedFilterChain.java:66)
>         at org.apache.shiro.web.servlet.AbstractShiroFilter.executeChain(AbstractShiroFilter.java:449)
>         at org.apache.shiro.web.servlet.AbstractShiroFilter$1.call(AbstractShiroFilter.java:365)
>         at org.apache.shiro.subject.support.SubjectCallable.doCall(SubjectCallable.java:90)
>         at org.apache.shiro.subject.support.SubjectCallable.call(SubjectCallable.java:83)
>         at org.apache.shiro.subject.support.DelegatingSubject.execute(DelegatingSubject.java:383)
>         at org.apache.shiro.web.servlet.AbstractShiroFilter.doFilterInternal(AbstractShiroFilter.java:362)
>         at org.apache.shiro.web.servlet.OncePerRequestFilter.doFilter(OncePerRequestFilter.java:125)
>         at org.eclipse.jetty.servlet.ServletHandler$CachedChain.doFilter(ServletHandler.java:1634)
>         at org.eclipse.jetty.servlet.ServletHandler.doHandle(ServletHandler.java:533)
>         at org.eclipse.jetty.server.handler.ScopedHandler.handle(ScopedHandler.java:146)
>         at org.eclipse.jetty.security.SecurityHandler.handle(SecurityHandler.java:548)
>         at org.eclipse.jetty.server.handler.HandlerWrapper.handle(HandlerWrapper.java:132)
>         at org.eclipse.jetty.server.handler.ScopedHandler.nextHandle(ScopedHandler.java:257)
>         at org.eclipse.jetty.server.session.SessionHandler.doHandle(SessionHandler.java:1595)
>         at org.eclipse.jetty.server.handler.ScopedHandler.nextHandle(ScopedHandler.java:255)
>         at org.eclipse.jetty.server.handler.ContextHandler.doHandle(ContextHandler.java:1340)
>         at org.eclipse.jetty.server.handler.ScopedHandler.nextScope(ScopedHandler.java:203)
>         at org.eclipse.jetty.servlet.ServletHandler.doScope(ServletHandler.java:473)
>         at org.eclipse.jetty.server.session.SessionHandler.doScope(SessionHandler.java:1564)
>         at org.eclipse.jetty.server.handler.ScopedHandler.nextScope(ScopedHandler.java:201)
>         at org.eclipse.jetty.server.handler.ContextHandler.doScope(ContextHandler.java:1242)
>         at org.eclipse.jetty.server.handler.ScopedHandler.handle(ScopedHandler.java:144)
>         at org.eclipse.jetty.server.handler.ContextHandlerCollection.handle(ContextHandlerCollection.java:220)
>         at org.eclipse.jetty.server.handler.HandlerCollection.handle(HandlerCollection.java:126)
>         at org.eclipse.jetty.server.handler.StatisticsHandler.handle(StatisticsHandler.java:174)
>         at org.eclipse.jetty.server.handler.HandlerWrapper.handle(HandlerWrapper.java:132)
>         at org.eclipse.jetty.server.Server.handle(Server.java:503)
>         at org.eclipse.jetty.server.HttpChannel.handle(HttpChannel.java:364)
>         at org.eclipse.jetty.server.HttpConnection.onFillable(HttpConnection.java:260)
>         at org.eclipse.jetty.io.AbstractConnection$ReadCallback.succeeded(AbstractConnection.java:305)
>         at org.eclipse.jetty.io.FillInterest.fillable(FillInterest.java:103)
>         at org.eclipse.jetty.io.ChannelEndPoint$2.run(ChannelEndPoint.java:118)
>         at org.eclipse.jetty.util.thread.strategy.EatWhatYouKill.runTask(EatWhatYouKill.java:333)
>         at org.eclipse.jetty.util.thread.strategy.EatWhatYouKill.doProduce(EatWhatYouKill.java:310)
>         at org.eclipse.jetty.util.thread.strategy.EatWhatYouKill.tryProduce(EatWhatYouKill.java:168)
>         at org.eclipse.jetty.util.thread.strategy.EatWhatYouKill.run(EatWhatYouKill.java:126)
>         at org.eclipse.jetty.util.thread.ReservedThreadExecutor$ReservedThread.run(ReservedThreadExecutor.java:366)
>         at org.eclipse.jetty.util.thread.QueuedThreadPool.runJob(QueuedThreadPool.java:765)
>         at org.eclipse.jetty.util.thread.QueuedThreadPool$2.run(QueuedThreadPool.java:683)
>         at java.lang.Thread.run(Thread.java:748)
> Caused by: org.eclipse.kapua.service.device.call.kura.exception.KuraMqttDeviceCallException: Error:
>         at org.eclipse.kapua.service.device.call.kura.KuraDeviceCallImpl.send(KuraDeviceCallImpl.java:134)
>         ... 83 common frames omitted
> Caused by: org.eclipse.kapua.transport.mqtt.MqttClientException: Error: org.eclipse.kapua.transport.message.mqtt.MqttTopic@1e7d0a8b
>         at org.eclipse.kapua.transport.mqtt.MqttFacade.sendSync(MqttFacade.java:90)
>         at org.eclipse.kapua.transport.mqtt.MqttFacade.sendSync(MqttFacade.java:32)
>         at org.eclipse.kapua.service.device.call.kura.KuraDeviceCallImpl.send(KuraDeviceCallImpl.java:129)
>         ... 83 common frames omitted
> 16:43:49.762 [qtp913190639-16] WARN  org.eclipse.kapua.KapuaExc

**Comment by lorthirk** [comment]
It looks like the log is not complete, you could attach it as a file perhaps. Anyway, it seems that the error is in the connectivity side now. Is the device online and connected?

**Comment by gitsaycat** [comment]
Hi @lorthirk 
The target devices are definitely online - so it could be again something silly - will check out other issues and come back with more logging if possible. 
Thanks Gitsaycat

**Comment by gitsaycat** [comment]
Good news @lorthirk!
As you may recall I was having problems with all device related API calls. WIth your help - I am now successfully making calls on the configuration read operations. The command execution part is currently the only issue. 

Key take-aways:
Some concepts need to be made clearer but knowing what I know now, the solutions are not very hard to work out. 

Many thanks for your patience!

**Comment by lorthirk** [comment]
Honestly the Swagger definition file needs a major refactoring. I hope I can find some time to improve it soon.

**Comment by gitsaycat** [comment]
I'd love to help with that!
In the meantime it seems the execution now works, but there is an exception at MQTTFacade - possibly because the response is null although the reply queue is created and the response message is placed on it (checked with mqtt-spy)
Any idea what could be the problem this time?

> org.eclipse.kapua.service.device.call.kura.exception.KuraMqttDeviceCallException: Error:
>         at org.eclipse.kapua.service.device.call.kura.KuraDeviceCallImpl.send(KuraDeviceCallImpl.java:137)
>         at org.eclipse.kapua.service.device.call.kura.KuraDeviceCallImpl.execute(KuraDeviceCallImpl.java:73)
>         at org.eclipse.kapua.service.device.call.kura.KuraDeviceCallImpl.execute(KuraDeviceCallImpl.java:43)
>         at org.eclipse.kapua.service.device.management.commons.call.DeviceCallExecutor.send(DeviceCallExecutor.java:129)
>         at org.eclipse.kapua.service.device.management.command.internal.DeviceCommandManagementServiceImpl.exec(DeviceCommandManagementServiceImpl.java:92)
>         at org.eclipse.kapua.app.api.resources.v1.resources.DeviceManagementCommands.sendCommand(DeviceManagementCommands.java:90)
>         at sun.reflect.GeneratedMethodAccessor389.invoke(Unknown Source)
>         at sun.reflect.DelegatingMethodAccessorImpl.invoke(DelegatingMethodAccessorImpl.java:43)
>         at java.lang.reflect.Method.invoke(Method.java:498)
>         at org.glassfish.jersey.server.model.internal.ResourceMethodInvocationHandlerFactory$1.invoke(ResourceMethodInvocationHandlerFactory.java:81)
>         at org.glassfish.jersey.server.model.internal.AbstractJavaResourceMethodDispatcher$1.run(AbstractJavaResourceMethodDispatcher.java:144)
>         at org.glassfish.jersey.server.model.internal.AbstractJavaResourceMethodDispatcher.invoke(AbstractJavaResourceMethodDispatcher.java:161)
>         at org.glassfish.jersey.server.model.internal.JavaResourceMethodDispatcherProvider$TypeOutInvoker.doDispatch(JavaResourceMethodDispatcherProvider.java:205)
>         at org.glassfish.jersey.server.model.internal.AbstractJavaResourceMethodDispatcher.dispatch(AbstractJavaResourceMethodDispatcher.java:99)
>         at org.glassfish.jersey.server.model.ResourceMethodInvoker.invoke(ResourceMethodInvoker.java:389)
>         at org.glassfish.jersey.server.model.ResourceMethodInvoker.apply(ResourceMethodInvoker.java:347)
>         at org.glassfish.jersey.server.model.ResourceMethodInvoker.apply(ResourceMethodInvoker.java:102)
>         at org.glassfish.jersey.server.ServerRuntime$2.run(ServerRuntime.java:326)
>         at org.glassfish.jersey.internal.Errors$1.call(Errors.java:271)
>         at org.glassfish.jersey.internal.Errors$1.call(Errors.java:267)
>         at org.glassfish.jersey.internal.Errors.process(Errors.java:315)
>         at org.glassfish.jersey.internal.Errors.process(Errors.java:297)
>         at org.glassfish.jersey.internal.Errors.process(Errors.java:267)
>         at org.glassfish.jersey.process.internal.RequestScope.runInScope(RequestScope.java:317)
>         at org.glassfish.jersey.server.ServerRuntime.process(ServerRuntime.java:305)
>         at org.glassfish.jersey.server.ApplicationHandler.handle(ApplicationHandler.java:1154)
>         at org.glassfish.jersey.servlet.WebComponent.serviceImpl(WebComponent.java:473)
>         at org.glassfish.jersey.servlet.WebComponent.service(WebComponent.java:427)
>         at org.glassfish.jersey.servlet.ServletContainer.service(ServletContainer.java:388)
>         at org.glassfish.jersey.servlet.ServletContainer.service(ServletContainer.java:341)
>         at org.glassfish.jersey.servlet.ServletContainer.service(ServletContainer.java:228)
>         at org.eclipse.jetty.servlet.ServletHolder.handle(ServletHolder.java:865)
>         at org.eclipse.jetty.servlet.ServletHandler$CachedChain.doFilter(ServletHandler.java:1655)
>         at org.eclipse.jetty.websocket.server.WebSocketUpgradeFilter.doFilter(WebSocketUpgradeFilter.java:215)
>         at org.eclipse.jetty.servlet.ServletHandler$CachedChain.doFilter(ServletHandler.java:1642)
>         at org.apache.shiro.web.servlet.ProxiedFilterChain.doFilter(ProxiedFilterChain.java:61)
>         at org.apache.shiro.web.servlet.AdviceFilter.executeChain(AdviceFilter.java:108)
>         at org.apache.shiro.web.servlet.AdviceFilter.doFilterInternal(AdviceFilter.java:137)
>         at org.apache.shiro.web.servlet.OncePerRequestFilter.doFilter(OncePerRequestFilter.java:125)
>         at org.apache.shiro.web.servlet.ProxiedFilterChain.doFilter(ProxiedFilterChain.java:66)
>         at org.apache.shiro.web.servlet.AdviceFilter.executeChain(AdviceFilter.java:108)
>         at org.apache.shiro.web.servlet.AdviceFilter.doFilterInternal(AdviceFilter.java:137)
>         at org.apache.shiro.web.servlet.OncePerRequestFilter.doFilter(OncePerRequestFilter.java:125)
>         at org.apache.shiro.web.servlet.ProxiedFilterChain.doFilter(ProxiedFilterChain.java:66)
>         at org.apache.shiro.web.servlet.AbstractShiroFilter.executeChain(AbstractShiroFilter.java:449)
>         at org.apache.shiro.web.servlet.AbstractShiroFilter$1.call(AbstractShiroFilter.java:365)
>         at org.apache.shiro.subject.support.SubjectCallable.doCall(SubjectCallable.java:90)
>         at org.apache.shiro.subject.support.SubjectCallable.call(SubjectCallable.java:83)
>         at org.apache.shiro.subject.support.DelegatingSubject.execute(DelegatingSubject.java:383)
>         at org.apache.shiro.web.servlet.AbstractShiroFilter.doFilterInternal(AbstractShiroFilter.java:362)
>         at org.apache.shiro.web.servlet.OncePerRequestFilter.doFilter(OncePerRequestFilter.java:125)
>         at org.eclipse.jetty.servlet.ServletHandler$CachedChain.doFilter(ServletHandler.java:1634)
>         at org.eclipse.jetty.servlet.ServletHandler.doHandle(ServletHandler.java:533)
>         at org.eclipse.jetty.server.handler.ScopedHandler.handle(ScopedHandler.java:146)
>         at org.eclipse.jetty.security.SecurityHandler.handle(SecurityHandler.java:548)
>         at org.eclipse.jetty.server.handler.HandlerWrapper.handle(HandlerWrapper.java:132)
>         at org.eclipse.jetty.server.handler.ScopedHandler.nextHandle(ScopedHandler.java:257)
>         at org.eclipse.jetty.server.session.SessionHandler.doHandle(SessionHandler.java:1595)
>         at org.eclipse.jetty.server.handler.ScopedHandler.nextHandle(ScopedHandler.java:255)
>         at org.eclipse.jetty.server.handler.ContextHandler.doHandle(ContextHandler.java:1340)
>         at org.eclipse.jetty.server.handler.ScopedHandler.nextScope(ScopedHandler.java:203)
>         at org.eclipse.jetty.servlet.ServletHandler.doScope(ServletHandler.java:473)
>         at org.eclipse.jetty.server.session.SessionHandler.doScope(SessionHandler.java:1564)
>         at org.eclipse.jetty.server.handler.ScopedHandler.nextScope(ScopedHandler.java:201)
>         at org.eclipse.jetty.server.handler.ContextHandler.doScope(ContextHandler.java:1242)
>         at org.eclipse.jetty.server.handler.ScopedHandler.handle(ScopedHandler.java:144)
>         at org.eclipse.jetty.server.handler.ContextHandlerCollection.handle(ContextHandlerCollection.java:220)
>         at org.eclipse.jetty.server.handler.HandlerCollection.handle(HandlerCollection.java:126)
>         at org.eclipse.jetty.server.handler.StatisticsHandler.handle(StatisticsHandler.java:174)
>         at org.eclipse.jetty.server.handler.HandlerWrapper.handle(HandlerWrapper.java:132)
>         at org.eclipse.jetty.server.Server.handle(Server.java:503)
>         at org.eclipse.jetty.server.HttpChannel.handle(HttpChannel.java:364)
>         at org.eclipse.jetty.server.HttpConnection.onFillable(HttpConnection.java:260)
>         at org.eclipse.jetty.io.AbstractConnection$ReadCallback.succeeded(AbstractConnection.java:305)
>         at org.eclipse.jetty.io.FillInterest.fillable(FillInterest.java:103)
>         at org.eclipse.jetty.io.ChannelEndPoint$2.run(ChannelEndPoint.java:118)
>         at org.eclipse.jetty.util.thread.strategy.EatWhatYouKill.runTask(EatWhatYouKill.java:333)
>         at org.eclipse.jetty.util.thread.strategy.EatWhatYouKill.doProduce(EatWhatYouKill.java:310)
>         at org.eclipse.jetty.util.thread.strategy.EatWhatYouKill.tryProduce(EatWhatYouKill.java:168)
>         at org.eclipse.jetty.util.thread.strategy.EatWhatYouKill.run(EatWhatYouKill.java:126)
>         at org.eclipse.jetty.util.thread.ReservedThreadExecutor$ReservedThread.run(ReservedThreadExecutor.java:366)
>         at org.eclipse.jetty.util.thread.QueuedThreadPool.runJob(QueuedThreadPool.java:765)
>         at org.eclipse.jetty.util.thread.QueuedThreadPool$2.run(QueuedThreadPool.java:683)
>         at java.lang.Thread.run(Thread.java:748)
> Caused by: org.eclipse.kapua.service.device.call.kura.exception.KuraMqttDeviceCallException: Error:
>         at org.eclipse.kapua.service.device.call.kura.KuraDeviceCallImpl.send(KuraDeviceCallImpl.java:134)
>         ... 83 common frames omitted
> Caused by: org.eclipse.kapua.transport.mqtt.MqttClientException: Error: org.eclipse.kapua.transport.message.mqtt.MqttTopic@7f2052a
>         at org.eclipse.kapua.transport.mqtt.MqttFacade.sendSync(MqttFacade.java:90)
>         at org.eclipse.kapua.transport.mqtt.MqttFacade.sendSync(MqttFacade.java:32)
>         at org.eclipse.kapua.service.device.call.kura.KuraDeviceCallImpl.send(KuraDeviceCallImpl.java:129)
>         ... 83 common frames omitted
> 


Incidentally this exception

**Comment by gitsaycat** [comment]
For clarity:

- 
- The command is created and sent out from nodejs from the front end
- The request topic is correctly created with the request message in it
- The target device receives the message, processes the command 
- The command response is then correctly placed in the response topic (all verified using mqtt-spy)

At this point I would expect the API server to pick up the response object from the response topic and send it back to the nodejs caller. 
However, it seems that MQTTFacade uses the synchronous version of send and for some reason because the response object is not found, and it throws the exception

**Comment by lorthirk** [comment]
A long shot, but a too short timeout perhaps? I can't see any reason why it shouldn't work :\ @riccardomodanese any idea?

**Comment by riccardomodanese** [comment]
Hi, I didn't read so carefully the whole thread so if I'm missing something please tell me.
From what I saw in your last stacktrace @gitsaycat it seems that a timeout occurred.
But I'm not so sure because this exception could be raised also if the response message is not parsed and converted correctly.
Could you track the MQTT response message from your device to be sure that is a message parsable by Kapua translators?
If so could you try a new attempt after raising up the timeout (if not permitted by the API call you are using you can restart the environment with an overwritten default value setting the timeout parameter [see timeout](https://github.com/eclipse/kapua/blob/develop/service/device/commons/src/main/java/org/eclipse/kapua/service/device/management/commons/setting/DeviceManagementSettingKey.java#L32) )

**Comment by lorthirk** [comment]
@gitsaycat Did the request change in the last attempts? Could you post it again please?

**Comment by Coduz** [comment]
Can this be closed?
